{
  "id": "thornwall",
  "name": "Thornwall",
  "description": "A fortified city built from dark stone, surrounded by a moat and thorny briar walls. The inner city is divided into four districts: the Merchant Quarter, the Old Keep, the Temple District, and the Slums. The city guards are loyal to Baron Kael, a ruthless but effective ruler. The city sprawls across dozens of chunks with winding streets, hidden alleys, and underground passages.",
  "type": "city",
  "biomeId": "darkwood_forest",
  "districts": ["merchant_quarter", "old_keep", "temple_district", "slums", "harbor"],
  "structures": ["thornwall_keep", "market_hall", "temple_of_light", "tavern_red_ale", "blacksmith_forge", "city_gate_north", "city_gate_south", "sewers_entrance"],
  "connections": ["village_oakhaven", "road_kings_highway", "dungeon_crypts"],
  "sizeX": 8,
  "sizeY": 8,
  "properties": {
    "population": "12000",
    "ruler": "Baron Kael Ironhand",
    "faction": "kingdom_of_ashenvale",
    "danger_level": "low_inside_walls",
    "economy": "trade_hub"
  }
}
